[
  { "id": "ai-start",       "order": 0, "level": "entry",        "moduleCount": 8,  "icon": "rocket",   "title": { "ko": "시작 코스: AI 제로 → 첫 수익 8단계", "en": "Starter: AI Zero → First Income (8 steps)" }, "subtitle": { "ko": "완전 초보용 8단계 온보딩" } },
  { "id": "ai-intro",       "order": 1, "level": "entry",        "moduleCount": 44, "icon": "sprout",   "title": { "ko": "AI 입문",   "en": "AI Intro" } },
  { "id": "ai-work",        "order": 2, "level": "practitioner", "moduleCount": 48, "icon": "briefcase","title": { "ko": "AI 실무",   "en": "AI for Work" }, "prerequisites": ["ai-intro"] },
  { "id": "ai-builder",     "order": 3, "level": "builder",      "moduleCount": 44, "icon": "hammer",   "title": { "ko": "AI 빌더",   "en": "AI Builder" } },
  { "id": "ai-engineer",    "order": 4, "level": "engineer",     "moduleCount": 49, "icon": "cpu",      "title": { "ko": "AI 엔지니어","en": "AI Engineer" } },
  { "id": "automation",     "order": 5, "level": "automation",   "moduleCount": 42, "icon": "workflow", "title": { "ko": "자동화 개발","en": "Automation Dev" } },
  { "id": "ai-finance",     "order": 6, "level": "finance",      "moduleCount": 55, "icon": "coins",    "title": { "ko": "AI 금융",   "en": "AI Finance" } },
  { "id": "ai-trends",      "order": 7, "level": "trends",       "moduleCount": 15, "icon": "trending-up","title": { "ko": "AI 트렌드", "en": "AI Trends" }, "autoUpdated": true }
]
